{
  "chartId": "soup_normal_01",
  "soupName": "キレのある香味スープ",
  "version": 1,
  "schemaVersion": 1,
  "bpm": 130,
  "durationMs": 45000,
  "events": [
    {
      "timeMs": 900,
      "action": "tsuki",
      "ingredientType": "carrot",
      "lane": "left",
      "windowMs": 170
    },
    {
      "timeMs": 1700,
      "action": "shuto",
      "ingredientType": "onion",
      "lane": "right",
      "windowMs": 160
    },
    {
      "timeMs": 2500,
      "action": "tsuki",
      "ingredientType": "pepper",
      "lane": "center",
      "windowMs": 160
    },
    {
      "timeMs": 3300,
      "action": "shuto",
      "ingredientType": "broccoli",
      "lane": "left",
      "windowMs": 160
    },
    {
      "timeMs": 4100,
      "action": "tsuki",
      "ingredientType": "corn",
      "lane": "right",
      "windowMs": 150
    },
    {
      "timeMs": 5200,
      "action": "shuto",
      "ingredientType": "tomato",
      "lane": "center",
      "windowMs": 150
    },
    {
      "timeMs": 6400,
      "action": "tsuki",
      "ingredientType": "garlic",
      "lane": "left",
      "windowMs": 150
    }
  ]
}
